### ISSUE TITLE
fake_useragent.errors.FakeUserAgentError: No browser user-agent strings found for browser: chrome

### ISSUE THREAD

**Issue by leo-aa88** [fake-useragent/fake-useragent#149]
Python version: 3.10.6
fake-useragent version: 0.1.14

To reproduce:

```
from fake_useragent import UserAgent

ua = UserAgent()
```

Error:

```
Error occurred during loading data. Trying to use cache server file https://useragent.melroy.org/cache.json
Traceback (most recent call last):
  File "/home/leonardo/Github/montecarlo-api/env/lib/python3.10/site-packages/fake_useragent/utils.py", line 139, in load
    browsers_dict[browser_name] = get_browser_user_agents(
  File "/home/leonardo/Github/montecarlo-api/env/lib/python3.10/site-packages/fake_useragent/utils.py", line 123, in get_browser_user_agents
    raise FakeUserAgentError(
fake_useragent.errors.FakeUserAgentError: No browser user-agent strings found for browser: chrome
Traceback (most recent call last):
  File "/home/leonardo/Github/montecarlo-api/env/lib/python3.10/site-packages/fake_useragent/utils.py", line 139, in load
    browsers_dict[browser_name] = get_browser_user_agents(
  File "/home/leonardo/Github/montecarlo-api/env/lib/python3.10/site-packages/fake_useragent/utils.py", line 123, in get_browser_user_agents
    raise FakeUserAgentError(
fake_useragent.errors.FakeUserAgentError: No browser user-agent strings found for browser: chrome

During handling of the above exception, another exception occurred:

Traceback (most recent call last):
  File "/usr/lib/python3.10/urllib/request.py", line 1348, in do_open
    h.request(req.get_method(), req.selector, req.data, headers,
  File "/usr/lib/python3.10/http/client.py", line 1282, in request
    self._send_request(method, url, body, headers, encode_chunked)
  File "/usr/lib/python3.10/http/client.py", line 1328, in _send_request
    self.endheaders(body, encode_chunked=encode_chunked)
  File "/usr/lib/python3.10/http/client.py", line 1277, in endheaders
    self._send_output(message_body, encode_chunked=encode_chunked)
  File "/usr/lib/python3.10/http/client.py", line 1037, in _send_output
    self.send(msg)
  File "/usr/lib/python3.10/http/client.py", line 975, in send
    self.connect()
  File "/usr/lib/python3.10/http/client.py", line 1447, in connect
    super().connect()
  File "/usr/lib/python3.10/http/client.py", line 941, in connect
    self.sock = self._create_connection(
  File "/usr/lib/python3.10/socket.py", line 845, in create_connection
    raise err
  File "/usr/lib/python3.10/socket.py", line 833, in create_connection
    sock.connect(sa)
TimeoutError: timed out

During handling of the above exception, another exception occurred:

Traceback (most recent call last):
  File "/home/leonardo/Github/montecarlo-api/env/lib/python3.10/site-packages/fake_useragent/utils.py", line 64, in get
    urlopen(
  File "/usr/lib/python3.10/urllib/request.py", line 216, in urlopen
    return opener.open(url, data, timeout)
  File "/usr/lib/python3.10/urllib/request.py", line 519, in open
    response = self._open(req, data)
  File "/usr/lib/python3.10/urllib/request.py", line 536, in _open
    result = self._call_chain(self.handle_open, protocol, protocol +
  File "/usr/lib/python3.10/urllib/request.py", line 496, in _call_chain
    result = func(*args)
  File "/usr/lib/python3.10/urllib/request.py", line 1391, in https_open
    return self.do_open(http.client.HTTPSConnection, req,
  File "/usr/lib/python3.10/urllib/request.py", line 1351, in do_open
    raise URLError(err)
urllib.error.URLError: <urlopen error timed out>

During handling of the above exception, another exception occurred:

Traceback (most recent call last):
  File "<stdin>", line 1, in <module>
  File "/home/leonardo/Github/montecarlo-api/env/lib/python3.10/site-packages/fake_useragent/fake.py", line 64, in __init__
    self.load()
  File "/home/leonardo/Github/montecarlo-api/env/lib/python3.10/site-packages/fake_useragent/fake.py", line 70, in load
    self.data_browsers = load_cached(
  File "/home/leonardo/Github/montecarlo-api/env/lib/python3.10/site-packages/fake_useragent/utils.py", line 209, in load_cached
    update(path, browsers, use_cache_server=use_cache_server, verify_ssl=verify_ssl)
  File "/home/leonardo/Github/montecarlo-api/env/lib/python3.10/site-packages/fake_useragent/utils.py", line 203, in update
    path, load(browsers, use_cache_server=use_cache_server, verify_ssl=verify_ssl)
  File "/home/leonardo/Github/montecarlo-api/env/lib/python3.10/site-packages/fake_useragent/utils.py", line 154, in load
    jsonLines = get(
  File "/home/leonardo/Github/montecarlo-api/env/lib/python3.10/site-packages/fake_useragent/utils.py", line 87, in get
    raise FakeUserAgentError("Maximum amount of retries reached")
fake_useragent.errors.FakeUserAgentError: Maximum amount of retries reached
```

**Comment by melroy89** [comment]
The fallback server was indeed down for a small while (should be up now).

HOWEVER, I'm more interested in why the code went ultimately for the fallback cache server? 

Can't you access https://useragentstring.com/pages/chrome/? Since ideally `fake-useragent` will get the data from there.

I want to know why the code actually choice to go for the fallback (which is the last resort).

**Comment by melroy89** [comment]
@araujo88 Could you give me maybe the log above "Error occurred during loading data." line? So the logging above the current logging you already shared.

**Comment by leo-aa88** [comment]
> @araujo88 Could you give me maybe the log above "Error occurred during loading data." line? So the logging above the current logging you already shared.

This was the beginning of the log error message. What is intriguing is that I am trying to reproduce the error again and it appears to work properly.

**Comment by melroy89** [comment]
Ow.. I was indeed hoping on a bit more output too bad.

Well the fallback server is up. That explains why it works for you at all now. 

However you can disable this fallback behavior by using the following code instead (which disables the cache server fallback):

```py
from fake_useragent import UserAgent
ua = UserAgent(use_cache_server=False)
```

**Comment by ehaupt** [comment]
Same here as `useragentstring.com` is down:

```sh
$ curl https://useragentstring.com/pages/chrome/
curl: (35) OpenSSL SSL_connect: Connection reset by peer in connection to useragentstring.com:443 
```

**Comment by melroy89** [comment]
So who of the two are using **Amazon Web Services (AWS)** to deploy hundreds deployments causing tens of thousands of requests/sec? That using fake-useragent code every time from scratch yesterday? 

The site useragentstring.com is not down at all, however you two are calling the script so many times (*without* local caching) that useragentstring.com is blocking you! 

**Whoever this is doing please STOP and CHECK your code and setup.**

The cache server is the last resort and now DDoS my system as well (probably not on purpose but still), logging says it comes from `compute.amazonaws.com`:

```log
05:29:25.199999 IP (tos 0x0, ttl 64, id 20499, offset 0, flags [DF], proto TCP (6), length 2948)
    melroy-server.https > ec2-18-220-151-79.us-east-2.compute.amazonaws.com.54058: Flags [P.], seq 478395761:478398657, ack 3954493779, win 135, options [nop,nop,TS val 631806356 ecr 4235624938], length 2896
05:29:25.203436 IP (tos 0x0, ttl 64, id 18030, offset 0, flags [DF], proto TCP (6), length 2948)
    melroy-server.https > ec2-52-14-37-187.us-east-2.compute.amazonaws.com.51330: Flags [P.], seq 2492053283:2492056179, ack 3579063683, win 135, options [nop,nop,TS val 715285409 ecr 1149703524], length 2896
```

Nginx access log snippet. Look at the timestamps, its called tens of thousands of times per second:

```log
3.140.250.209 - - [12/Nov/2022:05:53:28 +0100]  "GET /cache.json HTTP/1.1" 200 97957 "-" "Python-urllib/3.10" "useragent.melroy.org" 7.297
18.118.85.117 - - [12/Nov/2022:05:53:28 +0100]  "GET /cache.json HTTP/1.1" 200 97957 "-" "Python-urllib/3.10" "useragent.melroy.org" 5.124
3.16.125.82 - - [12/Nov/2022:05:53:28 +0100]  "GET /cache.json HTTP/1.1" 200 97957 "-" "Python-urllib/3.10" "useragent.melroy.org" 0.002
3.16.13.10 - - [12/Nov/2022:05:53:28 +0100]  "GET /cache.json HTTP/1.1" 200 97957 "-" "Python-urllib/3.10" "useragent.melroy.org" 0.000
3.16.13.10 - - [12/Nov/2022:05:53:28 +0100]  "GET /cache.json HTTP/1.1" 200 97957 "-" "Python-urllib/3.10" "useragent.melroy.org" 5.136
3.16.138.56 - - [12/Nov/2022:05:53:28 +0100]  "GET /cache.json HTTP/1.1" 200 97957 "-" "Python-urllib/3.10" "useragent.melroy.org" 5.119
18.222.142.3 - - [12/Nov/2022:05:53:28 +0100]  "GET /cache.json HTTP/1.1" 200 97957 "-" "Python-urllib/3.10" "useragent.melroy.org" 5.121
3.144.201.93 - - [12/Nov/2022:05:53:28 +0100]  "GET /cache.json HTTP/1.1" 200 97957 "-" "Python-urllib/3.10" "useragent.melroy.org" 18.194
18.118.167.14 - - [12/Nov/2022:05:53:28 +0100]  "GET /cache.json HTTP/1.1" 200 81573 "-" "Python-urllib/3.10" "useragent.melroy.org" 5.006
18.222.102.6 - - [12/Nov/2022:05:53:28 +0100]  "GET /cache.json HTTP/1.1" 200 97957 "-" "Python-urllib/3.10" "useragent.melroy.org" 31.744
18.118.8.237 - - [12/Nov/2022:05:53:28 +0100]  "GET /cache.json HTTP/1.1" 200 81573 "-" "Python-urllib/3.10" "useragent.melroy.org" 6.240
52.15.126.233 - - [12/Nov/2022:05:53:28 +0100]  "GET /cache.json HTTP/1.1" 200 81573 "-" "Python-urllib/3.10" "useragent.melroy.org" 5.120
18.117.176.191 - - [12/Nov/2022:05:53:28 +0100]  "GET /cache.json HTTP/1.1" 200 97957 "-" "Python-urllib/3.10" "useragent.melroy.org" 4.797
3.138.109.11 - - [12/Nov/2022:05:53:28 +0100]  "GET /cache.json HTTP/1.1" 200 97957 "-" "Python-urllib/3.10" "useragent.melroy.org" 5.119
3.21.134.143 - - [12/Nov/2022:05:53:28 +0100]  "GET /cache.json HTTP/1.1" 200 97957 "-" "Python-urllib/3.10" "useragent.melroy.org" 5.120
3.140.244.241 - - [12/Nov/2022:05:53:28 +0100]  "GET /cache.json HTTP/1.1" 200 97957 "-" "Python-urllib/3.10" "useragent.melroy.org" 0.001
18.218.112.109 - - [12/Nov/2022:05:53:28 +0100]  "GET /cache.json HTTP/1.1" 200 81573 "-" "Python-urllib/3.10" "useragent.melroy.org" 5.005
3.16.125.82 - - [12/Nov/2022:05:53:28 +0100]  "GET /cache.json HTTP/1.1" 200 81573 "-" "Python-urllib/3.10" "useragent.melroy.org" 7.361
13.59.2.149 - - [12/Nov/2022:05:53:28 +0100]  "GET /cache.json HTTP/1.1" 200 97957 "-" "Python-urllib/3.10" "useragent.melroy.org" 60.000
18.222.213.43 - - [12/Nov/2022:05:53:28 +0100]  "GET /cache.json HTTP/1.1" 200 97957 "-" "Python-urllib/3.10" "useragent.melroy.org" 2.308
18.222.213.43 - - [12/Nov/2022:05:53:28 +0100]  "GET /cache.json HTTP/1.1" 200 179877 "-" "Python-urllib/3.10" "useragent.melroy.org" 2.797
3.134.80.44 - - [12/Nov/2022:05:53:28 +0100]  "GET /cache.json HTTP/1.1" 200 81573 "-" "Python-urllib/3.10" "useragent.melroy.org" 7.068
18.221.28.148 - - [12/Nov/2022:05:53:28 +0100]  "GET /cache.json HTTP/1.1" 200 97957 "-" "Python-urllib/3.10" "useragent.melroy.org" 2.880
18.221.28.148 - - [12/Nov/2022:05:53:28 +0100]  "GET /cache.json HTTP/1.1" 200 97957 "-" "Python-urllib/3.10" "useragent.melroy.org" 5.119
3.16.138.56 - - [12/Nov/2022:05:53:28 +0100]  "GET /cache.json HTTP/1.1" 200 97957 "-" "Python-urllib/3.10" "useragent.melroy.org" 6.241
18.117.176.191 - - [12/Nov/2022:05:53:28 +0100]  "GET /cache.json HTTP/1.1" 200 97957 "-" "Python-urllib/3.10" "useragent.melroy.org" 5.123
3.142.68.165 - - [12/Nov/2022:05:53:28 +0100]  "GET /cache.json HTTP/1.1" 200 97957 "-" "Python-urllib/3.10" "useragent.melroy.org" 4.608
18.118.167.14 - - [12/Nov/2022:05:53:28 +0100]  "GET /cache.json HTTP/1.1" 200 97957 "-" "Python-urllib/3.10" "useragent.melroy.org" 5.004
3.141.5.53 - - [12/Nov/2022:05:53:28 +0100]  "GET /cache.json HTTP/1.1" 200 97957 "-" "Python-urllib/3.10" "useragent.melroy.org" 5.180
3.144.215.60 - - [12/Nov/2022:05:53:28 +0100]  "GET /cache.json HTTP/1.1" 200 97957 "-" "Python-urllib/3.10" "useragent.melroy.org" 5.920
3.128.24.66 - - [12/Nov/2022:05:53:28 +0100]  "GET /cache.json HTTP/1.1" 200 97957 "-" "Python-urllib/3.10" "useragent.melroy.org" 0.000
3.128.24.66 - - [12/Nov/2022:05:53:28 +0100]  "GET /cache.json HTTP/1.1" 200 97957 "-" "Python-urllib/3.10" "useragent.melroy.org" 0.001
3.15.30.10 - - [12/Nov/2022:05:53:28 +0100]  "GET /cache.json HTTP/1.1" 200 97957 "-" "Python-urllib/3.10" "useragent.melroy.org" 4.095
18.118.8.237 - - [12/Nov/2022:05:53:28 +0100]  "GET /cache.json HTTP/1.1" 200 97957 "-" "Python-urllib/3.10" "useragent.melroy.org" 5.179
18.218.187.217 - - [12/Nov/2022:05:53:28 +0100]  "GET /cache.json HTTP/1.1" 200 97957 "-" "Python-urllib/3.10" "useragent.melroy.org" 5.119
18.220.97.131 - - [12/Nov/2022:05:53:28 +0100]  "GET /cache.json HTTP/1.1" 200 97957 "-" "Python-urllib/3.10" "useragent.melroy.org" 4.997
3.16.138.56 - - [12/Nov/2022:05:53:28 +0100]  "GET /cache.json HTTP/1.1" 200 97957 "-" "Python-urllib/3.10" "useragent.melroy.org" 4.736
3.16.138.56 - - [12/Nov/2022:05:53:28 +0100]  "GET /cache.json HTTP/1.1" 200 97957 "-" "Python-urllib/3.10" "useragent.melroy.org" 5.121
3.141.5.181 - - [12/Nov/2022:05:53:28 +0100]  "GET /cache.json HTTP/1.1" 200 97957 "-" "Python-urllib/3.10" "useragent.melroy.org" 0.000
3.22.194.145 - - [12/Nov/2022:05:53:28 +0100]  "GET /cache.json HTTP/1.1" 200 97957 "-" "Python-urllib/3.10" "useragent.melroy.org" 6.714
3.129.245.42 - - [12/Nov/2022:05:53:29 +0100]  "GET /cache.json HTTP/1.1" 200 97957 "-" "Python-urllib/3.10" "useragent.melroy.org" 0.000
18.222.213.161 - - [12/Nov/2022:05:53:29 +0100]  "GET /cache.json HTTP/1.1" 200 97957 "-" "Python-urllib/3.10" "useragent.melroy.org" 4.641
```

**Comment by leo-aa88** [comment]
> So who of the two are using **Amazon Web Services (AWS)** to deploy hundreds deployments causing tens of thousands of requests/sec? That using fake-useragent code every time from scratch yesterday?
> 
> The site useragentstring.com is not down at all, however you two are calling the script so many times (_without_ local caching) that useragentstring.com is blocking you!
> 
> **Whoever this is doing please STOP and CHECK your code and setup.**
> 
> The cache server is the last resort and now DDoS my system as well (probably not on purpose but still), logging says it comes from `compute.amazonaws.com`:
> 
> ```
> 05:29:25.199999 IP (tos 0x0, ttl 64, id 20499, offset 0, flags [DF], proto TCP (6), length 2948)
>     melroy-server.https > ec2-18-220-151-79.us-east-2.compute.amazonaws.com.54058: Flags [P.], seq 478395761:478398657, ack 3954493779, win 135, options [nop,nop,TS val 631806356 ecr 4235624938], length 2896
> 05:29:25.203436 IP (tos 0x0, ttl 64, id 18030, offset 0, flags [DF], proto TCP (6), length 2948)
>     melroy-server.https > ec2-52-14-37-187.us-east-2.compute.amazonaws.com.51330: Flags [P.], seq 2492053283:2492056179, ack 3579063683, win 135, options [nop,nop,TS val 715285409 ecr 1149703524], length 2896
> ```
> 
> Nginx access log snippet. Look at the timestamps, its called tens of thousands of times per second:
> 
> ```
> 3.140.250.209 - - [12/Nov/2022:05:53:28 +0100]  "GET /cache.json HTTP/1.1" 200 97957 "-" "Python-urllib/3.10" "useragent.melroy.org" 7.297
> 18.118.85.117 - - [12/Nov/2022:05:53:28 +0100]  "GET /cache.json HTTP/1.1" 200 97957 "-" "Python-urllib/3.10" "useragent.melroy.org" 5.124
> 3.16.125.82 - - [12/Nov/2022:05:53:28 +0100]  "GET /cache.json HTTP/1.1" 200 97957 "-" "Python-urllib/3.10" "useragent.melroy.org" 0.002
> 3.16.13.10 - - [12/Nov/2022:05:53:28 +0100]  "GET /cache.json HTTP/1.1" 200 97957 "-" "Python-urllib/3.10" "useragent.melroy.org" 0.000
> 3.16.13.10 - - [12/Nov/2022:05:53:28 +0100]  "GET /cache.json HTTP/1.1" 200 97957 "-" "Python-urllib/3.10" "useragent.melroy.org" 5.136
> 3.16.138.56 - - [12/Nov/2022:05:53:28 +0100]  "GET /cache.json HTTP/1.1" 200 97957 "-" "Python-urllib/3.10" "useragent.melroy.org" 5.119
> 18.222.142.3 - - [12/Nov/2022:05:53:28 +0100]  "GET /cache.json HTTP/1.1" 200 97957 "-" "Python-urllib/3.10" "useragent.melroy.org" 5.121
> 3.144.201.93 - - [12/Nov/2022:05:53:28 +0100]  "GET /cache.json HTTP/1.1" 200 97957 "-" "Python-urllib/3.10" "useragent.melroy.org" 18.194
> 18.118.167.14 - - [12/Nov/2022:05:53:28 +0100]  "GET /cache.json HTTP/1.1" 200 81573 "-" "Python-urllib/3.10" "useragent.melroy.org" 5.006
> 18.222.102.6 - - [12/Nov/2022:05:53:28 +0100]  "GET /cache.json HTTP/1.1" 200 97957 "-" "Python-urllib/3.10" "useragent.melroy.org" 31.744
> 18.118.8.237 - - [12/Nov/2022:05:53:28 +0100]  "GET /cache.json HTTP/1.1" 200 81573 "-" "Python-urllib/3.10" "useragent.melroy.org" 6.240
> 52.15.126.233 - - [12/Nov/2022:05:53:28 +0100]  "GET /cache.json HTTP/1.1" 200 81573 "-" "Python-urllib/3.10" "useragent.melroy.org" 5.120
> 18.117.176.191 - - [12/Nov/2022:05:53:28 +0100]  "GET /cache.json HTTP/1.1" 200 97957 "-" "Python-urllib/3.10" "useragent.melroy.org" 4.797
> 3.138.109.11 - - [12/Nov/2022:05:53:28 +0100]  "GET /cache.json HTTP/1.1" 200 97957 "-" "Python-urllib/3.10" "useragent.melroy.org" 5.119
> 3.21.134.143 - - [12/Nov/2022:05:53:28 +0100]  "GET /cache.json HTTP/1.1" 200 97957 "-" "Python-urllib/3.10" "useragent.melroy.org" 5.120
> 3.140.244.241 - - [12/Nov/2022:05:53:28 +0100]  "GET /cache.json HTTP/1.1" 200 97957 "-" "Python-urllib/3.10" "useragent.melroy.org" 0.001
> 18.218.112.109 - - [12/Nov/2022:05:53:28 +0100]  "GET /cache.json HTTP/1.1" 200 81573 "-" "Python-urllib/3.10" "useragent.melroy.org" 5.005
> 3.16.125.82 - - [12/Nov/2022:05:53:28 +0100]  "GET /cache.json HTTP/1.1" 200 81573 "-" "Python-urllib/3.10" "useragent.melroy.org" 7.361
> 13.59.2.149 - - [12/Nov/2022:05:53:28 +0100]  "GET /cache.json HTTP/1.1" 200 97957 "-" "Python-urllib/3.10" "useragent.melroy.org" 60.000
> 18.222.213.43 - - [12/Nov/2022:05:53:28 +0100]  "GET /cache.json HTTP/1.1" 200 97957 "-" "Python-urllib/3.10" "useragent.melroy.org" 2.308
> 18.222.213.43 - - [12/Nov/2022:05:53:28 +0100]  "GET /cache.json HTTP/1.1" 200 179877 "-" "Python-urllib/3.10" "useragent.melroy.org" 2.797
> 3.134.80.44 - - [12/Nov/2022:05:53:28 +0100]  "GET /cache.json HTTP/1.1" 200 81573 "-" "Python-urllib/3.10" "useragent.melroy.org" 7.068
> 18.221.28.148 - - [12/Nov/2022:05:53:28 +0100]  "GET /cache.json HTTP/1.1" 200 97957 "-" "Python-urllib/3.10" "useragent.melroy.org" 2.880
> 18.221.28.148 - - [12/Nov/2022:05:53:28 +0100]  "GET /cache.json HTTP/1.1" 200 97957 "-" "Python-urllib/3.10" "useragent.melroy.org" 5.119
> 3.16.138.56 - - [12/Nov/2022:05:53:28 +0100]  "GET /cache.json HTTP/1.1" 200 97957 "-" "Python-urllib/3.10" "useragent.melroy.org" 6.241
> 18.117.176.191 - - [12/Nov/2022:05:53:28 +0100]  "GET /cache.json HTTP/1.1" 200 97957 "-" "Python-urllib/3.10" "useragent.melroy.org" 5.123
> 3.142.68.165 - - [12/Nov/2022:05:53:28 +0100]  "GET /cache.json HTTP/1.1" 200 97957 "-" "Python-urllib/3.10" "useragent.melroy.org" 4.608
> 18.118.167.14 - - [12/Nov/2022:05:53:28 +0100]  "GET /cache.json HTTP/1.1" 200 97957 "-" "Python-urllib/3.10" "useragent.melroy.org" 5.004
> 3.141.5.53 - - [12/Nov/2022:05:53:28 +0100]  "GET /cache.json HTTP/1.1" 200 97957 "-" "Python-urllib/3.10" "useragent.melroy.org" 5.180
> 3.144.215.60 - - [12/Nov/2022:05:53:28 +0100]  "GET /cache.json HTTP/1.1" 200 97957 "-" "Python-urllib/3.10" "useragent.melroy.org" 5.920
> 3.128.24.66 - - [12/Nov/2022:05:53:28 +0100]  "GET /cache.json HTTP/1.1" 200 97957 "-" "Python-urllib/3.10" "useragent.melroy.org" 0.000
> 3.128.24.66 - - [12/Nov/2022:05:53:28 +0100]  "GET /cache.json HTTP/1.1" 200 97957 "-" "Python-urllib/3.10" "useragent.melroy.org" 0.001
> 3.15.30.10 - - [12/Nov/2022:05:53:28 +0100]  "GET /cache.json HTTP/1.1" 200 97957 "-" "Python-urllib/3.10" "useragent.melroy.org" 4.095
> 18.118.8.237 - - [12/Nov/2022:05:53:28 +0100]  "GET /cache.json HTTP/1.1" 200 97957 "-" "Python-urllib/3.10" "useragent.melroy.org" 5.179
> 18.218.187.217 - - [12/Nov/2022:05:53:28 +0100]  "GET /cache.json HTTP/1.1" 200 97957 "-" "Python-urllib/3.10" "useragent.melroy.org" 5.119
> 18.220.97.131 - - [12/Nov/2022:05:53:28 +0100]  "GET /cache.json HTTP/1.1" 200 97957 "-" "Python-urllib/3.10" "useragent.melroy.org" 4.997
> 3.16.138.56 - - [12/Nov/2022:05:53:28 +0100]  "GET /cache.json HTTP/1.1" 200 97957 "-" "Python-urllib/3.10" "useragent.melroy.org" 4.736
> 3.16.138.56 - - [12/Nov/2022:05:53:28 +0100]  "GET /cache.json HTTP/1.1" 200 97957 "-" "Python-urllib/3.10" "useragent.melroy.org" 5.121
> 3.141.5.181 - - [12/Nov/2022:05:53:28 +0100]  "GET /cache.json HTTP/1.1" 200 97957 "-" "Python-urllib/3.10" "useragent.melroy.org" 0.000
> 3.22.194.145 - - [12/Nov/2022:05:53:28 +0100]  "GET /cache.json HTTP/1.1" 200 97957 "-" "Python-urllib/3.10" "useragent.melroy.org" 6.714
> 3.129.245.42 - - [12/Nov/2022:05:53:29 +0100]  "GET /cache.json HTTP/1.1" 200 97957 "-" "Python-urllib/3.10" "useragent.melroy.org" 0.000
> 18.222.213.161 - - [12/Nov/2022:05:53:29 +0100]  "GET /cache.json HTTP/1.1" 200 97957 "-" "Python-urllib/3.10" "useragent.melroy.org" 4.641
> ```

Shouldn't the cache server have some sort of protection against possible DDoS attacks and rate limiting?

**Comment by melroy89** [comment]
Yeah it should, but it's not yet there. Anyway, I think I will add the cache file locally. So packaged into the pypi release so no dependency anymore with the internet would be required.

Also maybe it's just somebody who don't know how-to program Python so they don't do it on purpose. 😆 

Where you using Amazon AWS 🤔 ?

**Comment by melroy89** [comment]
See follow-up item: https://github.com/fake-useragent/fake-useragent/issues/150

**Comment by leo-aa88** [comment]
> Yeah it should, but it's not yet there. Anyway, I think I will add the cache file locally. So packaged into the pypi release so no dependency anymore with the internet would be required.
> 
> Also maybe it's just somebody who don't know how-to program Python so they don't do it on purpose. laughing
> 
> Where you using Amazon AWS thinking ?

I wasn't using AWS. I was using it locally.

**Comment by ehaupt** [comment]
> > Where you using Amazon AWS thinking ?
> 
> I wasn't using AWS. I was using it locally.

Same here. Testing it locally before updating the [FreeBSD port](https://cgit.freebsd.org/ports/commit/?id=07dde5ad28a28deafee40a03e2d2b77e1a539c67).

**Comment by melroy89** [comment]
https://github.com/fake-useragent/fake-useragent/pull/151 will also fixes this issue, since the data is stored locally within the package by default. No internet required or external resources that could cause any of those issues mentioned earlier.

**Comment by danger89** [comment]
v1.0.0 should fix this now once and for all. Please update & try again.

**Comment by melroy89** [comment]
You can try out the latest release (v1.0.1), update via:

```sh
pip install --upgrade fake-useragent
```
